kind,doc_id,doc_saint,doc_title_english,doc_title_geez,doc_title_amharic,doc_title_transliteration,section_id,section_title_english,section_title_geez,section_title_amharic,section_title_transliteration,block_id,block_type,speaker,geez,amharic,english,transliteration,dynamic,overrideId,optional
block,,,,,,,,,,,,ep-pre-2,prayer,priest,,,"O Lord, Thou art He Who loosened our sufferings and all our burdens, and loosen the bonds of our sin, and took our trouble and quicken us, and became to us the way towards the place of life, Thou did turn us from destruction unto salvation.",,\N,\N,\N
block,,,,,,,,,,,,ep-pre-3,prayer,priest,,,"O Lord, our almighty God, Father of our Lord and Saviour Jesus Christ, Whose curtain is light, Whose face is fire, and the throne of Whose glory is ineffable, and the abode of joy which cannot be spoken of, which He has prepared for the holy ones. His garments are the treasures of light.",,\N,\N,\N
block,,,,,,,,,,,,ep-pre-4,prayer,priest,,,"Thou keeps the holy angels, all of whom tremble and glorify Thee when Thou looks at them the mountains melt, and when Thy name is spoken of, springs come forth from the depth.",,\N,\N,\N
block,,,,,,,,,,,,ep-pre-5,prayer,priest,,,Thou art He who covered heaven gathering all in Thy hand the earth and the depths together tremble before Thee.,,\N,\N,\N
block,,,,,,,,,,,,ep-pre-6,prayer,priest,,,"All the hosts of the enemy were discomfited before Thee, the Devil fell, the beast was trodden down and the snake was destroyed.",,\N,\N,\N
block,,,,,,,,,,,,ep-pre-7,prayer,priest,,,"All the gentiles who believed in Thee were enlightened and strengthened by Thee. O Lord, through Thee life was seen, hope was strengthened, the gospel, through which destruction was destroyed, has been preached, and salvation was confirmed.",,\N,\N,\N
block,,,,,,,,,,,,ep-pre-8,prayer,priest,,,"O Lord our almighty God, make us worthy to partake of this bread, the body of Thy life-giving Son, and of this cup, the speaking blood of Thy Messiah, through Whom to Thee with Him and with the Holy Spirit be glory and dominion, both now and ever, and unto the ages of ages. Amen.",,\N,\N,\N
block,,,,,,,,,,,,ep-pre-9,response,congregation,,,"The hosts of the angels of the Saviour of the world, stand before the Saviour of the world and encircle the Saviour of the world, even the body and the blood of the Saviour of the world. Let us draw near the face of the Saviour of the world. In the faith which is of Him let us submit ourselves to Christ.",,\N,\N,\N
block,,,,,,,,,,,,ep-pre-10,prayer,deacon,,,"Open ye the gates, princes.",,\N,\N,\N
block,,,,,,,,,,,,ep-pre-11,prayer,deacon,,,"Ye who are standing, bow your heads.",,\N,\N,\N
block,,,,,,,,,,,,ep-pre-12,prayer,priest,,,"Let the Lamb come that we may see Him with our eyes, immolate Him with our hands and rejoice in Him. May His body be joined with this bread, and may His blood be poured into this cup.",,\N,\N,\N
block,,,,,,,,,,,,ep-pre-13,prayer,priest,,,"Let none of us think when he eats of this bread that he eats mere flesh without blood and Spirit, and let none of us think when he drinks of this cup that he drinks mere blood without body and Spirit, but one is the Body, Blood and Spirit as His divinity became one with His humanity, unto the ages of ages.",,\N,\N,\N
block,,,,,,,,,,,,ep-pre-14,prayer,deacon,,,Worship the Lord with fear.,,\N,\N,\N
block,,,,,,,,,,,,ep-pre-15,response,congregation,,,"Before Thee, Lord, do we worship, and Thee do we glorify.",,\N,\N,\N
section,,,,,,,saint-epiphanius-penitence,Prayer of Penitence,,,,,,,,,,,,,
block,,,,,,,,,,,,ep-pen-1,heading,\N,,,Prayer of Penitence,,\N,\N,\N
block,,,,,,,,,,,,ep-pen-2,prayer,deacon,,,Give heed.,,\N,\N,\N
block,,,,,,,,,,,,ep-pen-3,prayer,priest,,,Holy things for the holy.,,\N,\N,\N
block,,,,,,,,,,,,ep-pen-4,response,congregation,,,"One is the holy Father, one is the holy Son, one is the Holy Spirit.",,\N,\N,\N
block,,,,,,,,,,,,ep-pen-5,prayer,priest,,,The Lord be with all of you.,,\N,\N,\N
block,,,,,,,,,,,,ep-pen-6,response,congregation,,,And with your spirit.,,\N,\N,\N
block,,,,,,,,,,,,ep-pen-7,rubric,\N,,,The priest shall then lift up the whole host with his hand and say:,,\N,\N,\N
block,,,,,,,,,,,,ep-pen-8,prayer,priest,,,"Lord, have compassion upon us, O Christ. (three times in a loud chant, and fifteen times in a low chant.)",,\N,\N,\N
block,,,,,,,,,,,,ep-pen-9,rubric,\N,,,The people shall repeat his words. Then the priest shall repeat them three times and the people twice.,,\N,\N,\N
block,,,,,,,,,,,,ep-pen-10,prayer,deacon,,,"Ye that are penitent, bow your heads.",,\N,\N,\N
block,,,,,,,,,,,,ep-pen-11,rubric,\N,,,Then he shall turn to the people and say:,,\N,\N,\N
block,,,,,,,,,,,,ap-prec-8r,rubric,\N,\N,\N,The priest shall turn toward the people and say:,\N,\N,\N,\N
block,,,,,,,,,,,,ap-prec-8,prayer,priest,,,"Lord our God, look upon Thy people that are penitent, and according to Thy great mercy, have mercy upon them, and according to the multitude of Thy compassion blot out their iniquity, cover them and keep them from all evil.",,\N,\N,\N
block,,,,,,,,,,,,ap-prec-9,prayer,priest,,,"And redeem their souls in peace, forgive their former works, join them with Thy holy church, through the grace and compassion of Thine only-begotten Son our Lord, God, and Saviour Jesus Christ, through Whom to Thee with Him and with the Holy Spirit be glory and dominion, both now and ever and unto the ages of ages. Amen.",,\N,\N,\N
block,,,,,,,,,,,,ap-prec-10,prayer,deacon,,,Arise for prayer.,,\N,\N,\N
block,,,,,,,,,,,,ap-prec-11,response,congregation,,,Lord have mercy upon us.,,\N,\N,\N
block,,,,,,,,,,,,ap-prec-12,prayer,priest,እግዚአብሔር ምስለ ኵልክሙ።,እግዚአብሔር ከሁላችሁ ጋር ይሁን።,Peace be unto all of you.,Igzee'abihér misle kwulikimu.,\N,\N,\N
block,,,,,,,,,,,,ap-prec-13,response,congregation,ምስለ መንፈስከ።,ከመንፈስህ ጋራ።,And with your spirit.,Misle menfesike.,\N,\N,\N
block,,,,,,,,,,,,ap-prec-14,prayer,priest,,,"This is the true holy body of our Lord, God, and Saviour Jesus Christ, that is given for life, salvation, remission of sin unto them that receive of it in faith.",,\N,\N,\N
block,,,,,,,,,,,,ap-prec-14r,response,congregation,,,Amen.,,\N,\N,\N
block,,,,,,,,,,,,ap-prec-15,prayer,priest,,,"This is the true precious blood of our Lord, God, and Saviour Jesus Christ, which is given for life, salvation, and remission of sins into those who drink of it in faith.",,\N,\N,\N
block,,,,,,,,,,,,ap-prec-15r,response,congregation,,,Amen.,,\N,\N,\N
block,,,,,,,,,,,,ap-prec-16,prayer,priest,,,For this is the body and blood of Emmanuel our very God.,,\N,\N,\N
block,,,,,,,,,,,,ap-prec-16r,response,congregation,,,Amen.,,\N,\N,\N
block,,,,,,,,,,,,ap-prec-17,prayer,priest,,,"I believe, I believe, I believe and I confess, unto my last breath, that this is the body and blood of our Lord, God, and Saviour Jesus Christ, which He took from the Lady of us all, the holy Mary of twofold virginity, and made it one with His godhead without mixture or confusion, without division or alteration; and He verily confessed with a good testimony in the days of Pontius Pilate, and this body He gave up for our sakes and for the life of us all.",,\N,\N,\N
block,,,,,,,,,,,,ap-prec-17r,response,congregation,,,Amen.,,\N,\N,\N
block,,,,,,,,,,,,ap-prec-18,prayer,priest,,,"I believe, I believe, I believe and I confess that His godhead was not separated from His manhood, not for an hour nor for the twinkling of an eye, but He gave it up for our sakes for life, salvation, and remission of sin unto them that partake of it in faith.",,\N,\N,\N
block,,,,,,,,,,,,ap-prec-18r,response,congregation,,,Amen.,,\N,\N,\N
block,,,,,,,,,,,,ap-prec-19,prayer,priest,,,"I believe, I believe, I believe and I confess that this is the body and blood of our Lord, God, and Saviour Jesus Christ, and that to Him are rightly due honour and glory and adoration with His kind heavenly Father and the Holy Spirit, the life-giver, both now and ever and unto the ages of ages. Amen.",,\N,\N,\N
block,,,,,,,,,,,,ap-com-1r,rubric,\N,\N,\N,"Then the priest shall take in his hand the asbadikon which bears the sign of the cross, dip it into the chalice into the blood, and with it make the sign of the cross on the Body. Then, with the Body, he shall make the sign of the cross over the Blood and say:",\N,\N,\N,\N
block,,,,,,,,,,,,ap-com-1,prayer,priest,,,"Blessed be God, almighty Father, our God. And blessed be the only-begotten Son, our Lord and Saviour Jesus Christ. And blessed be the Holy Spirit the Paraclete, the comforter and cleanser of us all.",,\N,\N,\N
block,,,,,,,,,,,,ap-com-1b,rubric,\N,\N,\N,"Then the assistant deacon shall offer water to the priests and deacons to wash their hands, signifying that they should be holy in their souls.",\N,\N,\N,\N
block,,,,,,,,,,,,ap-com-2,prayer,priest,,,"Lord my God, behold the sacrifice of Thy Son's body, which pleases Thee. Through it blot out all my sins because Thine only-begotten Son died for me.",,\N,\N,\N
block,,,,,,,,,,,,ap-com-3,prayer,priest,,,"And behold the pure blood of Thy Messiah, which was shed for me upon Calvary, cries aloud in my stead. Grant that the testimony of this blood may be unto the forgiveness of me Thy servant.",,\N,\N,\N
block,,,,,,,,,,,,ap-com-4,prayer,priest,,,"And accept my prayers for its sake, because thy beloved accepted the spear and the nails for my sake, and suffered to please Thee. But after I was saved, Satan returned to my heart and pierced me through with his darts. Grant me, Lord, Thy mercy, because he is a powerful accuser.",,\N,\N,\N
block,,,,,,,,,,,,ap-com-5,prayer,priest,,,And by the provision of sin he slew me. Avenge me of the audacious one who is not satisfied with my being led astray from my life.,,\N,\N,\N
block,,,,,,,,,,,,ap-com-6,prayer,priest,,,"Thou, Lord, my King, God, Saviour bind up the wounds of soul and body of me Thy servant.",,\N,\N,\N
block,,,,,,,,,,,,ap-com-7r,rubric,\N,\N,\N,"Before receiving the Holy Communion, all communicants shall say:",\N,\N,\N,\N
block,,,,,,,,,,,,ap-com-7,prayer,all,,,"O my Lord Jesus Christ, it in no wise befits Thee to enter under the roof of my polluted house, for I have provoked Thee to wrath, for I have done evil in Thy sight, and through the transgression of Thy commandment have polluted my soul and body which Thou created after Thine image and likeness, yet in me dwells no good thing.",,\N,\N,\N
block,,,,,,,,,,,,ap-com-8,prayer,all,,,"But for the sake of Thy plan, and Thine incarnation for my salvation, for the sake of thy precious cross and Thy life-giving death, for the sake of Thy resurrection on the third day, I pray thee and beseech Thee, O my Lord, that Thou would purge me from all guilt and curse, and from all sin and defilement.",,\N,\N,\N
block,,,,,,,,,,,,ap-com-9,prayer,all,,,"And when I have received Thy holy mystery, let it not be unto me for judgement nor for condemnation, but have compassion upon me and have mercy upon me; and through it grant me remission of my sin and life for my soul, O life of the world, through the petition of our Lady, the holy Mary His mother of twofold virginity, and of John the Baptist, and through the prayer of all the holy angels, all the martyrs, and righteous who have fought for the good, unto ages of ages. Amen.",,\N,\N,\N
block,,,,,,,,,,,,ap-com-9r,rubric,\N,\N,\N,"The priest shall come out of the sanctuary and distribute the Holy Communion to the faithful in order. Then the men, then the women. But the babies who have already been baptized shall receive before the other faithful.",\N,\N,\N,\N
block,,,,,,,,,,,,ap-com-10r,rubric,\N,\N,\N,"While receiving the Holy Communion, the priest shall say to himself:",\N,\N,\N,\N
block,,,,,,,,,,,,ap-com-10,prayer,priest,,,"O my Lord Jesus Christ, let not this Thy mystery be iniquity in me, rather let it be for the purifying of my soul and my body.",,\N,\N,\N
block,,,,,,,,,,,,ap-com-11r,rubric,\N,\N,\N,"The celebrant receives of the Host first, next he shall give it to the assistant priest, who gives him the Blood; the assistant priest shall himself receive of the Blood. The celebrant shall give the priests of the Body, the assistant priest shall give them of the Blood.",\N,\N,\N,\N
block,,,,,,,,,,,,ap-com-12r,rubric,\N,\N,\N,"While offering the Holy Qurban at the time of the Anaphora of the Apostles, the priest shall say:",\N,\N,\N,\N
block,,,,,,,,,,,,ap-com-12,prayer,priest,,,"The bread of life which came down from heaven, the holy body of Christ.",,\N,\N,\N
block,,,,,,,,,,,,ap-com-12b,response,all,,,Amen.,,\N,\N,\N
block,,,,,,,,,,,,ap-com-13,prayer,all,,,"Holy, holy, holy Trinity ineffable, grant me to receive this body and His blood for life and not for condemnation. Grant me to bring forth fruit that shall be well-pleasing unto Thee, to the end that I may appear in Thy glory, and live unto Thee, doing Thy will.",,\N,\N,\N
block,,,,,,,,,,,,ap-com-14,prayer,all,,,"In faith I call upon Thee, Father, and call upon Thy Kingdom: hallowed, Lord, be Thy name upon us, for mighty art Thou, praised and glorious, and to Thee be glory, unto endless ages.",,\N,\N,\N
block,,,,,,,,,,,,ap-com-15r,rubric,\N,\N,\N,Then he shall consume what he has received. While chewing he shall put his hand on his mouth. He shall chew in fear and trembling without making any sound till he finishes. Then he shall say:,\N,\N,\N,\N
block,,,,,,,,,,,,ap-com-15,prayer,all,,,"Fill my mouth with praise, my heart with joy, and my soul with gladness, fill me who have received of this divine mystery, O Thou Who became man for the salvation of man.",,\N,\N,\N
block,,,,,,,,,,,,ap-com-16r,rubric,\N,\N,\N,When the assistant priest gives the blood he shall say:,\N,\N,\N,\N
block,,,,,,,,,,,,ap-com-16,prayer,priest,,,This is the cup of life that came down from heaven; this is the precious blood of Christ.,,\N,\N,\N
block,,,,,,,,,,,,ap-com-17,response,all,,,Amen and amen.,,\N,\N,\N
block,,,,,,,,,,,,ap-pcom-1r,rubric,\N,\N,\N,The Prayer of Basil. When the blood is in his mouth he shall say in his heart:,\N,\N,\N,\N
block,,,,,,,,,,,,ap-pcom-1,prayer,priest,,,"O my Lord and my God Jesus Christ, behold I have received Thy holy Body and Thy precious Blood. May they be for the remission of my sins and the blotting out of my trespasses.",,\N,\N,\N
block,,,,,,,,,,,,ap-pcom-2,prayer,priest,,,"O only-begotten Son and lover of man, fill my mouth with Thy praise that I may praise Thy glory, for Thou art He Who once became man and declared Himself through His incarnation in order to save me for ever. Thou has redeemed me for ever for the sake of Thy holy Name.",,\N,\N,\N
block,,,,,,,,,,,,ap-pcom-3,prayer,priest,,,"Glory be to Thee, O my Lord and my God Jesus Christ, Who has granted me Thy Body and Thy Blood at the hand of Thy servant. I glorify thee and pray thee that I may be in the midst of Thy flock, and that accepting me, Thou will number me with Thy sheep.",,\N,\N,\N
block,,,,,,,,,,,,ap-pcom-4,prayer,priest,,,"And now remember not my trespasses. I give thanks for Thy grace which has been granted unto me, and for Thy help which has been with me.",,\N,\N,\N
block,,,,,,,,,,,,ap-pcom-5r,rubric,\N,\N,\N,When the deacon receives the cup he shall say:,\N,\N,\N,\N
block,,,,,,,,,,,,ap-pcom-5,prayer,deacon,,,"I will take the cup of life, and call upon the name of the Lord. Pray ye for us and for all Christians who ask us to mention them. Praise ye and sing in the peace and love of Jesus Christ.",,\N,\N,\N
block,,,,,,,,,,,,ap-pcom-6r,rubric,\N,\N,\N,"And then the clergy shall chant Psalm 150. They shall chant one by one or two by two according to their number, without ceasing.",\N,\N,\N,\N
block,,,,,,,,,,,,ap-pcom-7r,rubric,\N,\N,\N,The priest shall say as he goes out:,\N,\N,\N,\N
block,,,,,,,,,,,,ap-pcom-7,prayer,priest,,,"Those whom Thou has called, Lord, and hallowed, make happy with Thy call, confirm with Thy power, keep with Thy love, join in Thine everlasting kingdom through Christ, through Whom to Thee with Him and with the Holy Spirit be glory and dominion, both now and ever and unto the ages of ages. Amen.",,\N,\N,\N
block,,,,,,,,,,,,ap-pcom-8r,rubric,\N,\N,\N,"When the priest goes out he shall bless over the Paten once. Then he shall offer the Body to the people, and the deacon shall offer the Blood.",\N,\N,\N,\N
block,,,,,,,,,,,,ap-pcom-9,prayer,priest,,,"O eternal God, light of life, Thou has given, Lord, unto us Thy servants strength and protection, during the present days and nights, keeping all in peace. Bless them on this present day, and on those to come hereafter, through our Lord Jesus Christ, through Whom to Thee with Him and with the Holy Spirit be glory and dominion, both now and ever and unto the ages of ages. Amen.",,\N,\N,\N
block,,,,,,,,,,,,ap-pcom-10,prayer,deacon,,,We thank God that we have partaken of His holy things; we pray and trust that which we have received may be healing for the life of the soul while we glorify the Lord our God.,,\N,\N,\N
block,,,,,,,,,,,,ap-pcom-11,prayer,priest,,,"My mouth shall speak the praise of the Lord, and let all flesh bless His holy Name for ever and ever.",,\N,\N,\N
block,,,,,,,,,,,,ap-pcom-12,response,congregation,,,"Our Father who art in heaven, lead us, Lord, that we may not enter into temptation.",,\N,\N,\N
block,,,,,,,,,,,,ap-thk-1,prayer,deacon,,,We have received of the holy body and the precious blood of Christ.,,\N,\N,\N
block,,,,,,,,,,,,ap-thk-2,prayer,priest,,,"My mouth shall speak the praise of the Lord, and let all flesh bless His holy name for ever and ever.",,\N,\N,\N
block,,,,,,,,,,,,ap-thk-3,response,congregation,,,"Our Father who art in heaven, lead us, Lord, that we may not enter into temptation.",,\N,\N,\N
block,,,,,,,,,,,,ap-thk-4,prayer,deacon,,,And let us give thanks unto Him that makes us ready to communicate in the precious and holy mystery.,,\N,\N,\N
block,,,,,,,,,,,,ap-thk-5,prayer,priest,,,"My mouth shall speak the praise of the Lord, and let all flesh bless His holy name for ever and ever.",,\N,\N,\N
block,,,,,,,,,,,,ap-thk-6,response,congregation,,,"Our Father who art in heaven, lead us, Lord, that we may not enter into temptation.",,\N,\N,\N
block,,,,,,,,,,,,ap-thk-7r,rubric,\N,\N,\N,The priest shall sing in Izl:,\N,\N,\N,\N
block,,,,,,,,,,,,ap-thk-7,prayer,priest,,,"I will extol Thee, my King and my God, and I will bless Thy name for ever and ever.",,\N,\N,\N
block,,,,,,,,,,,,ap-thk-8,response,congregation,,,"Our Father who art in heaven, lead us, Lord, that we may not enter into temptation.",,\N,\N,\N
block,,,,,,,,,,,,ap-thk-9,prayer,priest,,,"Every day will I bless Thee, and I will praise Thy name for ever and ever.",,\N,\N,\N
block,,,,,,,,,,,,ap-thk-10,response,congregation,,,"Our Father who art in heaven, lead us, Lord, that we may not enter into temptation.",,\N,\N,\N
block,,,,,,,,,,,,ap-thk-11,prayer,priest,,,"My mouth shall speak the praise of the Lord, and let all flesh bless His holy name for ever and ever.",,\N,\N,\N
section,,,,,,,saint-epiphanius-post-communion,Post-Communion,,,,,,,,,,,,,
block,,,,,,,,,,,,ep-pcom-1,rubric,\N,,,After receiving the Holy Communion.,,\N,\N,\N
block,,,,,,,,,,,,ep-pcom-2,heading,\N,,,Pilot of the Soul,,\N,\N,\N
block,,,,,,,,,,,,ep-pcom-3,prayer,priest,,,"Again we supplicate the Almighty God, Father of our Lord and Saviour Jesus Christ, because He did neither disdain nor refuse our supplication, nor did He remove His mercy from us, because the Lord our God is merciful.",,\N,\N,\N
block,,,,,,,,,,,,ep-pcom-4,prayer,deacon,,,Pray ye.,,\N,\N,\N
block,,,,,,,,,,,,ep-pcom-5,prayer,priest,,,"Yea Lord, Thou art the God of all. Yea Lord, Thou art the King of all. Yea Lord, Thou art Almighty. Yea Lord, Thou art the Governor of all. Yea Lord, Thou art the Saviour of all. Yea Lord, Thou art the Judge of all. Yea Lord, Thou art the Life-giver of all. Yea Lord, Thou art the Keeper of all. Yea Lord, Thou art the Nourisher of all.",,\N,\N,\N
block,,,,,,,,,,,,ep-pcom-6,prayer,priest,,,"As Thou did join the body of Thy Son with our body, and Thou did mix the blood of Thy Messiah with our blood, so put Thy fear in our hearts and the beauty of Thy worship in our minds.",,\N,\N,\N
block,,,,,,,,,,,,ep-pcom-7,prayer,priest,,,"We, who are carnal, mind the things of the flesh and do the works of the flesh and walk in the way of the flesh. But Thou taught us the work of the Spirit and makes us to understand the law of the Spirit and leads us in the way of the Spirit.",,\N,\N,\N
block,,,,,,,,,,,,ep-pcom-8,prayer,priest,,,"Because if Thou pity us, we sinners, then Thou will be called compassionate. Thou pities the righteous because of their works and recompenses them according to their righteousness.",,\N,\N,\N
block,,,,,,,,,,,,ep-pcom-9,prayer,priest,,,"Remember not against us former iniquities; let Thy tender mercies, O God, speedily prevent us.",,\N,\N,\N
block,,,,,,,,,,,,ep-pcom-10,prayer,priest,,,"Towards Thee we cry, towards Thee we weep, Thee we entreat, unto the endless ages.",,\N,\N,\N
block,,,,,,,,,,,,ep-pcom-11,response,congregation,,,Amen.,,\N,\N,\N
block,,,,,,,,,,,,ep-pcom-12,heading,\N,,,The Laying on of the Hand,,\N,\N,\N
block,,,,,,,,,,,,ep-pcom-13,prayer,priest,,,"He is higher than all that is high. No mind and no heart can interpret the riches of Thy gift, O Master, because Thou has hid these things from the wise and prudent and has revealed them unto babes.",,\N,\N,\N
block,,,,,,,,,,,,ep-pcom-14,prayer,priest,,,"These things which prophets and kings have desired to see but have not seen, Thou has granted us sinners: that we may serve and be sanctified by them, when Thou established for us the order of Thine only-begotten Son. The hidden mystery cannot be compared to the blood of the old law nor the righteousness of the flesh, but it is the heavenly Lamb and the sacrifice speaking without flesh.",,\N,\N,\N
block,,,,,,,,,,,,ep-pcom-15,prayer,priest,,,"Sanctify the lips of us who offer this sacrifice, and purify our hearts from being mixed with vanity, and send upon us the grace of the Holy Spirit that we may greet one another with a holy kiss and receive of Thy holy undying gift through Jesus Christ.",,\N,\N,\N
block,,,,,,,,,,,,ep-pcom-16,prayer,priest,,,"Through Whom to Thee with Him and with the Holy Spirit, the life-giver, Who is equal with Thee, be glory and dominion, both now and ever and unto the ages of ages. Amen.",,\N,\N,\N
